{"activity":"modeling","actor_id":"example-actor","artifact_refs":[],"event_id":"example-event","human_postprocess":null,"input_scope":["synthetic fixture only"],"model":"not-an-actual-provider-call","output_used":false,"provider":"synthetic-example","question_id":"Q1","schema_version":"2.0","timestamp":"2026-09-08T00:00:00Z","version_date":null}
